{
  "audience": {
    "detail": "Operators who need a repeatable way to turn a project idea into evidence-backed next work.",
    "label": "Project operators"
  },
  "authority": {
    "human_review_required": true,
    "may_change_public_accounts": false,
    "may_publish": false
  },
  "brief_id": "START-example-growth",
  "brief_revision": "r1",
  "brief_version": "1.0",
  "contains_personal_data": false,
  "created_at": "2026-08-31T17:00:00Z",
  "created_by": "operator",
  "goal": {
    "detail": "Establish the first evidence-backed recommendation for a synthetic project without pretending that it is a live-market result.",
    "title": "Validate a project research loop"
  },
  "non_goals": [
    "Publish or change a public account.",
    "Treat synthetic fixtures as real customer research."
  ],
  "project_id": "example-project",
  "project_profile_revision": "example-project-profile-v2",
  "research_question": "What must be known before a project can receive its first bounded recommendation?",
  "success_signal": {
    "detail": "All four readiness steps are explicit, evidence-bound where needed, and the recommendation is only ready to queue.",
    "label": "A verified first recommendation"
  }
}
